[
  {
    "persona": "Persona: Alice Chen\n\nBackground:\nAlice Chen is a 32-year-old Senior Financial Analyst from USA.\n\nDemographics:\nAge: 32\nGender: Female\nEducation: Master's Degree in Finance\nProfession: Senior Financial Analyst\nIncome: $150,000 USD\n\nFinancial Situation:\nAlice Chen has a high income level and manages their spending accordingly.\n\nBrowsing Habits:\nTech savviness: advanced. \n\nProfessional Life:\nWorks as a Senior Financial Analyst.\n\nPersonal Style:\nPractical and goal-oriented.\n\nPrimary Goal: To optimize portfolio performance and reduce reporting time.\nPain Points: Time-consuming manual data aggregation; Difficulty in real-time market analysis; Lack of integrated forecasting tools; Keeping up with regulatory changes",
    "intent": "To optimize portfolio performance and reduce reporting time.",
    "name": "Alice Chen",
    "age": 32,
    "gender": "Female",
    "maritalStatus": "married",
    "country": "USA",
    "occupation": "Senior Financial Analyst",
    "education": "Master's Degree in Finance",
    "incomeLevel": "high",
    "income": "$150,000 USD",
    "techSavviness": "advanced",
    "primaryGoal": "To optimize portfolio performance and reduce reporting time.",
    "painPoints": [
      "Time-consuming manual data aggregation",
      "Difficulty in real-time market analysis",
      "Lack of integrated forecasting tools",
      "Keeping up with regulatory changes"
    ],
    "relevanceScore": 9
  }
]